<?xml version="1.0" encoding="UTF-8"?>
<!--DTD generated by XMLSpy v2005 rel. 3 U (http://www.altova.com)-->
<!ELEMENT point EMPTY>
<!ATTLIST point
	id CDATA #REQUIRED
	x CDATA #REQUIRED
	y CDATA #REQUIRED
>
<!ELEMENT type (point+)>
<!ATTLIST type
	name CDATA #REQUIRED
	root (superposition|sequence|masking) #REQUIRED
>
<!ELEMENT types (type+)>
